{
  "schema_version": 1,
  "status": "passed",
  "command": "make integration-p10",
  "started_at": "2026-09-26T14:29:38Z",
  "finished_at": "2026-09-26T14:30:29Z",
  "source": {
    "repository": "https://github.com/otuschhoff/rados-go.git",
    "identity": "content-addressed-artifacts",
    "artifacts": {
      "internal/cephx/connector.go": "0300251fb70087691876d14571aa44e684bf8a8e3c6b4e39866bd6ca209c875c",
      "internal/cephx/connector_test.go": "e351fc0a647111a226951c46b0506542cc4902a42e3e55d693b9f8d7447c6d37",
      "internal/cephx/core.go": "ad393c2a60c0067acb68afa68bfd09d876b11d968a58ab80840c0bb556af1d7b",
      "internal/cephx/core_test.go": "c0349e6dd460b15c86ea32e100c7908fe3461708027fccfe4cba35feb0bff2f5",
      "internal/cephx/credentials.go": "50e51d3d0db50dc9a979f4a3c95747fdf4777b79c0e619e1b6d8702253488255",
      "internal/cephx/credentials_test.go": "f44c53c9253881f630c98345219516f61dd33a501aff74a5039827ccec9dce53",
      "internal/cephx/fixture_test.go": "a59892b95c406ca6bb9ed77f0c4f428b5901330604b3c38e08f670a540f0e0d5",
      "internal/cephx/fuzz_test.go": "987b6da5615ac292e35d14b5d30e02b9711c1870f8ab58d0480da09046825b65",
      "internal/cephx/instance_id_test.go": "8a11c290c3c8837bc28fa8ad91a1c40c69f075707fb7e2b0602d7dac37270a9a",
      "internal/cephx/receive_budget_test.go": "793311990d2e766ae918f453c997288d29c6a5c32214c2290c9418a66152f362",
      "internal/cephx/service_connector.go": "ec6169db8f38420f6770f21012ba2d1420045984185d85c67f125b32ec422884",
      "internal/cephx/service_connector_test.go": "c963139bc2e8cd7c85290c729e526a5119cb02cd57e152d4f65f59edec54f4db",
      "internal/crush/hash.go": "21fb469ca5af7d8008c278d534a949732155ff8b2546f5db3ba94bd2c21f973f",
      "internal/crush/hash_test.go": "31fc74bfe4c1df7077a21b12397c7e978f5c7d290513738c18948bd1ec79eaca",
      "internal/crush/ln.go": "c06d4879ed78ea648a89cd8763bbd6b0a8bb773572d6359d78c54701b8c104b7",
      "internal/crush/map.go": "46e988e5bbfeda41ef924dea88228a35646cce38b9a6c88e56c9be7134d4afca",
      "internal/crush/map_test.go": "cdfe82ecf3bf51e846c5d61686da2784035281282ea6eb6517a103b137fa1aad",
      "internal/crush/p05_fixture_test.go": "089e93c6716e2e3df1ff5a96beefaa3697270f12b2fb09a48818ac1a236b1de5",
      "internal/crush/p10_fixture_test.go": "dc94467418fafd41c5fb2e916039684c18d8f45bfbdc8e23f23c634282f3ea82",
      "internal/crush/place.go": "d169f2e541b89bfbfe3775fc5afbeb104eee60f259addcf070bf48cfbe8909c7",
      "internal/crush/place_test.go": "b9ca6f2877732c2280bf05afda56ede67b4e430cf58ef5b55f666db898ead699",
      "internal/crush/placement.go": "1778a1748687b882c71bf8f32843adb3e63e57fc07a62afb42fbd6138d2721d7",
      "internal/crush/placement_test.go": "9febcde68a16e05a27d0d187eedc15af74a7df45943fa048b2f1e4f3407d8287",
      "internal/encoding/codec.go": "3f03d3783293a49d5de4986f28c615532cc54722fd5d4797448f883b683de550",
      "internal/encoding/codec_benchmark_test.go": "5ecc7c8ba2a14c8baf9917d8e39e3c294f6d141a99e8438ba7d7e729cba6784c",
      "internal/encoding/codec_test.go": "ac3316834d1f0bb1bb2633f5c777c70b082f55bd3a14057f5e14772039cbcfc5",
      "internal/encoding/crc.go": "9dce38e0846c80679a7182baeca6d4bd44a853b0a7841a507caa0a46675e9938",
      "internal/encoding/ownership_test.go": "83a7fc42a923faaea2eaae672c8ef659145681075b582f14001e5343a93606a2",
      "internal/maps/incremental.go": "de8687f425d1ceecb279e3e6efe05ae190e2a5189ec0a5ec845eae24363383f4",
      "internal/maps/incremental_test.go": "6128818955e8e133c384b52645c98a6b38219e328fb986d7affe97ac03f6c05c",
      "internal/maps/mgrmap.go": "32cad6af44c53081e24e417ce4de180fbc3fd72ddd270f12afe99b06b5d26b86",
      "internal/maps/mgrmap_test.go": "c5a092832cbbf117ffdafa333c7da553f2747b0a183806a15fdbeb9428797081",
      "internal/maps/monmap.go": "78bdda912e05c548ce55e827214dbedd0fe87e1e25cc0d5eb05edcf95c6979fb",
      "internal/maps/monmap_test.go": "a40babf7628a12698984a674e6eecf83b5fafcde65ebd9201953d80ae0d194b7",
      "internal/maps/osdmap.go": "bbf99f2c731911d8e26feeb912546926bc9cfb903aa60bdf0717a0ea87016c38",
      "internal/maps/osdmap_test.go": "3d2a5cf1aa5f9caa16d18fbbb58907f84a94f9677a66954f11f7f7edee4324fa",
      "internal/maps/p04_fixture_test.go": "98953880e9e9d7633d0ad10206491523f223125698fffa788616035245ac7088",
      "internal/maps/performance_baseline_test.go": "55aa8eb4ee95ac69ecbe5fce23e43a27f4fbf2c3117956440737f30c11b59b84",
      "internal/maps/placement.go": "3a66eadafb7fac7cc42b77329326e5ce8b1fbe98aa3e2d2191ba3b9c4f7de0f5",
      "internal/maps/placement_reuse_test.go": "9dfd26640045ab30aa01a30b3524653655177df1478d6f00c242c0922ae1affc",
      "internal/maps/placement_test.go": "96313b4783e2141560bae963c5f248473504c06358481275c9f245bf2d4b9f0f",
      "internal/maps/pool.go": "288ccdd4715dbc4a1ff8bcb936fc84ddd4d0c873138154ec9ec8fcabe0e86aea",
      "internal/maps/pool_test.go": "ad8ca192e7c4140fa901a36f4b68a8094fa6db3e7be854a6423e67686517f34c",
      "internal/mgr/client.go": "2f2d9eda2a066569ebcfb75ce3f237a917a151f9a8bc9ed57d46a2afc2f26c01",
      "internal/mgr/client_creation_test.go": "b01d342b66545794b6208943c4cd659cc17079eb0e29b95ef50e77ae6eb64307",
      "internal/mgr/client_test.go": "b8c27274ea87c90bb1405523fd0d7d42cbb1086d3ee122de983b174648a30941",
      "internal/mgr/messages.go": "219f3f716e0235620411f89d63a176f07755f09d3b0f62367c61248e0bffa45f",
      "internal/mgr/messages_test.go": "e222b249ed30f19a8c2cbc6dc724e2e8bb7d9aa034ff9a471a9d3f1c69201f0a",
      "internal/mon/client.go": "395115b3f507e1800ded0e1cceba59c13a9329848ace875efb1843b261ba8511",
      "internal/mon/client_test.go": "aac5cf7e88bd19cb938a943f4f97191e812dff49d75aa7ba364cbcd4f9b21c8b",
      "internal/mon/config.go": "0eeb3a41c49cf8738a394a2123bc986b90d14a061557732f9b26dfe652d6f412",
      "internal/mon/config_test.go": "336f697524ff14280570dbfd2bfb5ea367d78b9c72137977be7d4bc841178c02",
      "internal/mon/messages.go": "7e8d9b718ee96afc49a91153fadcf52efc33969a44025122faae5dbf4f9d9191",
      "internal/mon/messages_test.go": "2c4d97a81a9f3501ba35a480e8041531f8eb8cb8d151664d9bbc7009a75fb4d0",
      "internal/mon/seeds.go": "2174e1a673959466deb2b40348075656a58edad124b440b4d4b382039ce69eb2",
      "internal/mon/statfs_test.go": "60710977883279cb6744b8fbc1c67e002153f87a42a0037d7d5305fd0c3e7d11",
      "internal/msgr/banner.go": "46a374d27b4e24422d830c848541d56baad74dd13417653a02c1a6c0e1010527",
      "internal/msgr/banner_test.go": "0a956f1034ae80002a691504404dbc938356741ba7f182f502f34f47227af859",
      "internal/msgr/control.go": "2d205b3fb5ddb4df7f856592b528fa4932ffc1b122ff65ea4da52a1390ea24df",
      "internal/msgr/control_test.go": "212a88dbf2d14333bd722783c517d3d3b62554ba703555aa9cedbc5d49383b88",
      "internal/msgr/fixture_test.go": "1b1b0c9514c2aa4546eef1533180f7d19a8274af4c3594f34c0b36c33864f844",
      "internal/msgr/frame.go": "fb1080a71bfbff876785ab96dd0a629d588a32e052b3084586dbe5aedad66eed",
      "internal/msgr/frame_test.go": "82cb5c5e6d1304856c8458dd2fb5d7dd2e5bb5590b1e589a7e538aaa993350d2",
      "internal/msgr/fuzz_test.go": "0c6e17f14f7bbed9daf1d02040b35dc6a5f770a07c847462f43c58d08a16405c",
      "internal/msgr/message.go": "9c5269dd3ab9221e2168043ff668278b5dba585239e5b36b523b58941b1485ee",
      "internal/msgr/message_test.go": "b8f39d1b427df9ae87af257f2c1d36c2d51bc0d6b39ad015a4d97e97ab439870",
      "internal/msgr/mode_diagnostic.go": "73721764e277d66b38a7c876e8f3962a6a3e9a1169b88b3cd1ba7ac990bc6aec",
      "internal/msgr/mode_diagnostic_test.go": "687eb3bbdca2529e7c7800a03945550513c87aca562daae3231c374a58b08026",
      "internal/msgr/performance_baseline_test.go": "c63b2f723e46906b58cc4b1150309050ff07439f59543fbd9b95fcb4978749dd",
      "internal/msgr/phase4_budgeted_capture_test.go": "7a304f7e35aab050810df60b0c4aa03fb108bbd22d1b6d5e97aa6d3e358e6743",
      "internal/msgr/phase4_resource_test.go": "dd53030dbd8dc8db40ba34cde178afbdb10611c26957fc24b54de01f8b8ef0a2",
      "internal/msgr/phase4_stalled_test.go": "d33b5953e5f218c9074eb0207eb57d395f70017fc1662a2a8696d03cf584d148",
      "internal/msgr/queue_burst_benchmark_test.go": "78392e0a1b9dda766a97b057de9e09d51518772a5a692f6c06178f19888889fb",
      "internal/msgr/reader_retirement_test.go": "58d83510d1f47f7cb405436a5f6d1cb826744c28d271aa80f46ee77387023bec",
      "internal/msgr/receive_budget.go": "b11a0553f11cca97a7c8c92e132fd34ff6d2708dfe3177ca5e31cf312c81accc",
      "internal/msgr/receive_budget_benchmark_test.go": "35eec2babdc2db1800883c9be2dfdeef62b38d14ae36adf848ba249b65732d48",
      "internal/msgr/receive_budget_codec_test.go": "6799c9ddd1b50391afb74dec38fafe0b5729d6e73787438ca60551be9e3fe641",
      "internal/msgr/receive_budget_lifecycle_test.go": "1503b65254f5bb6a40beefa4729e7601ee441018c03b53d3f09ceacdff59b9de",
      "internal/msgr/receive_budget_stress_test.go": "12a91c113460bdf9309bd4e55eed2e33f067190970a51729f6b4e951fdd18e41",
      "internal/msgr/receive_budget_test.go": "535deea3dfaef45c553ef8beacca8242e22ac34ea182bddcea58c73fbef57517",
      "internal/msgr/receive_into_benchmark_test.go": "14fc934c61de63f9108af3189a7ab40a688a82a1eba21816d839cff502c44eba",
      "internal/msgr/receive_scratch.go": "9fb863409ddd418c02d02eccb2a17a5c6ab1ca7e8de2a9642164148bcdba7ddb",
      "internal/msgr/receive_scratch_inventory_test.go": "fd5fd60090e8192bc5b79d40e17e9820f185d2ad7ee521f5b33879235aa89d2a",
      "internal/msgr/receive_scratch_test.go": "7d47499324526b5b96ca87df72a2efdaa4312e568b16b1d686e314c1f0f93f31",
      "internal/msgr/reply_borrow_test.go": "21c2500038f4431271a3da35c683868d72f296dea824e6555ec807af67c7c455",
      "internal/msgr/request_timing.go": "05aadc5ed79ec08eb8b4ae059aeae2327537edd6c47e021762c4bbcee6dfdc93",
      "internal/msgr/request_timing_test.go": "cfa40e450c219276376a92cec47218efac7fc9bad9434e9e468d4e058b32d9cc",
      "internal/msgr/secure.go": "8eea7b17b46d48072ec02cb82a1cc1da758ffaaed6a38d4c3bab4801fce09103",
      "internal/msgr/secure_benchmark_test.go": "fc0ee1f7f321c26c63b0bbc79e99e05b826bc95c0952c82a265462b2511dfbec",